{
  "schema": "nostr_automerge.trusted_epoch_projection_gate.v12.v1",
  "status": "rcld_110_complete",
  "rcld": 110,
  "candidate_chain": [
    { "step": "step_1372", "candidate": "fd9ed9103879d4933832766c0c8dadb57262a49f" },
    { "step": "step_1373", "candidate": "25b540e176d291c9de823e8106e074a5d4eff48b" },
    { "step": "step_1374", "candidate": "eafa932ff4cfa7a4356827f2b97037a8d35c89f3" },
    { "step": "step_1375", "candidate": "6e7d13e735017ce310670ca70d56bd4e5225ac61" },
    { "step": "step_1376", "candidate": "bb2f600aeb08c74dd7c8556c1bfc14baa4568ce6" },
    { "step": "step_1377", "candidate": "41be17ed694f1e9848c47acd99a79f4513dfc2e4" },
    { "step": "step_1378", "candidate": "5b3a386160e3310071e644a7030ade80248640d5" }
  ],
  "requirements": [
    "NCRDT-RESOURCE-017",
    "NCRDT-RESOURCE-018",
    "NCRDT-RESOURCE-019",
    "NCRDT-EVIDENCE-007"
  ],
  "projection": {
    "source": "crates/nostr_automerge/src/graph/actor_state.rs",
    "source_sha256": "6e327e8f1300a0f2e62e211375365e7c57d20924a93af22ae9399b6f7341ace4",
    "sealed_constructors": 1,
    "semantic_cases": 8,
    "lookup_operations": 9,
    "publication_operations": 19
  },
  "work_contract": {
    "total_charges": 41,
    "graph_node_charges": 32,
    "graph_edge_charges": 9,
    "budget_matrix": "pass",
    "cancellation_matrix": "pass",
    "first_stop_preserved": true,
    "zero_post_stop_target_work": true,
    "predecessor_output_bytes": "equal",
    "unexpected_identity": "preserved"
  },
  "validators": [
    {
      "path": "scripts/validate_remediation_v12.py",
      "sha256": "0b204212805005720c1a8f79f247a59f7aa09981272f5ec58dbb9ce5e606bcd7"
    },
    {
      "path": "scripts/validate_resource_operation_inventory_v10.py",
      "sha256": "4359d156e5d5b750d462967d82d1d579438e16e0ad282d1288a799b9fa4909cc"
    }
  ],
  "findings": {
    "open": ["FINDING_100", "FINDING_101", "FINDING_102", "FINDING_103"],
    "held": ["FINDING_080"]
  },
  "holds": [
    "external_assurance",
    "event_kind_allocation",
    "nip_submission",
    "production_qualification",
    "publication",
    "release",
    "remote_mutation"
  ],
  "result": "pass"
}
